{
  "case_id": "aps_permitting_scheme_2026",
  "case_name": "Automated Passenger Services Permitting Scheme Consultation",
  "generated_at": "2026-07-02T22:02:44.967137+00:00",
  "extraction_method": "llm_deepseek_openai_compatible_no_truth_set",
  "source_truth_set": {
    "path": "",
    "fact_count": 0,
    "available": false
  },
  "entities": [
    {
      "id": "secretary_of_state_for_transport",
      "type": "government_body",
      "name": "Secretary of State for Transport",
      "description": "The appropriate national authority for granting APS permits for services resembling taxis/PHVs in England and bus/coach services anywhere in Great Britain. May delegate functions to DVSA.",
      "evidence_fact_ids": [
        "doc_para_1_1",
        "doc_para_1_2"
      ]
    },
    {
      "id": "dvsa",
      "type": "government_body",
      "name": "Driver and Vehicle Standards Agency",
      "description": "The body intended to grant APS permit applications on behalf of the Secretary of State for Transport. Also conducts internal reviews of decisions.",
      "evidence_fact_ids": [
        "doc_para_1_3",
        "doc_para_6_1"
      ]
    },
    {
      "id": "ccav",
      "type": "government_body",
      "name": "Centre for Connected and Autonomous Vehicles",
      "description": "The unit within the Department for Transport that is leading the consultation on the APS permitting scheme.",
      "evidence_fact_ids": [
        "doc_intro_1"
      ]
    },
    {
      "id": "consenting_authority",
      "type": "local_authority",
      "name": "Consenting Authority",
      "description": "Local licensing authority (for taxi/PHV-like services) or franchising body (for bus-like services) whose consent is required before a permit can be issued. Must respond within 6 weeks; silence gives automatic consent.",
      "evidence_fact_ids": [
        "doc_para_2_1",
        "doc_para_2_2"
      ]
    },
    {
      "id": "traffic_authority",
      "type": "public_body",
      "name": "Traffic Authority",
      "description": "Authority defined by the Road Traffic Regulation Act 1984 s.121A that must be consulted before a permit is granted if likely to be substantially affected.",
      "evidence_fact_ids": [
        "doc_para_1_4",
        "doc_para_4_1"
      ]
    },
    {
      "id": "emergency_services",
      "type": "public_body",
      "name": "Emergency Services",
      "description": "Emergency services likely to be substantially affected by a permit, which must be consulted before grant.",
      "evidence_fact_ids": [
        "doc_para_1_4",
        "doc_para_4_1"
      ]
    },
    {
      "id": "aps_permit_holder",
      "type": "operator",
      "name": "APS Permit Holder",
      "description": "Organisation granted an APS permit to operate an automated passenger service. Subject to conditions, reporting obligations, and potential variation/suspension/withdrawal.",
      "evidence_fact_ids": [
        "doc_para_1_5",
        "doc_para_5_1"
      ]
    },
    {
      "id": "aps_applicant",
      "type": "operator",
      "name": "APS Applicant",
      "description": "Organisation applying for an APS permit. Must provide information on service scope, operational competence, safeguarding, insurance, and engagement with stakeholders.",
      "evidence_fact_ids": [
        "doc_para_4_2",
        "doc_para_4_3"
      ]
    },
    {
      "id": "older_and_disabled_passengers",
      "type": "passenger_group",
      "name": "Older and Disabled Passengers",
      "description": "Passenger group whose needs must be considered in permit decisions and reported on by permit holders. Around 1 in 4 people in the UK report having a disability.",
      "evidence_fact_ids": [
        "doc_para_3_1",
        "doc_para_3_2"
      ]
    }
  ],
  "stakeholders": [
    {
      "id": "stk_ccav",
      "name": "Centre for Connected and Autonomous Vehicles",
      "archetype_group": "regulator",
      "stance_prior": "supportive",
      "interests": [
        "policy_impact"
      ],
      "evidence_fact_ids": [
        "doc_intro_1",
        "doc_intro_2"
      ],
      "weight": 0.8
    },
    {
      "id": "stk_dvsa",
      "name": "Driver and Vehicle Standards Agency",
      "archetype_group": "regulator",
      "stance_prior": "neutral",
      "interests": [
        "policy_impact"
      ],
      "evidence_fact_ids": [
        "doc_para_1_3",
        "doc_para_6_1"
      ]
    },
    {
      "id": "stk_consenting_authority",
      "name": "Consenting Authority (Local Licensing / Franchising Body)",
      "archetype_group": "local_government",
      "stance_prior": "cautious",
      "interests": [
        "policy_impact"
      ],
      "evidence_fact_ids": [
        "doc_para_2_1",
        "doc_para_2_2",
        "doc_para_2_3"
      ]
    },
    {
      "id": "stk_traffic_authority",
      "name": "Traffic Authority",
      "archetype_group": "local_government",
      "stance_prior": "cautious",
      "interests": [
        "policy_impact"
      ],
      "evidence_fact_ids": [
        "doc_para_4_1"
      ]
    },
    {
      "id": "stk_emergency_services",
      "name": "Emergency Services",
      "archetype_group": "public_safety",
      "stance_prior": "cautious",
      "interests": [
        "policy_impact"
      ],
      "evidence_fact_ids": [
        "doc_para_4_1",
        "doc_para_5_2"
      ]
    },
    {
      "id": "stk_aps_operator",
      "name": "APS Operator (Permit Holder / Applicant)",
      "archetype_group": "industry",
      "stance_prior": "supportive",
      "interests": [
        "policy_impact"
      ],
      "evidence_fact_ids": [
        "doc_intro_2",
        "doc_para_4_2",
        "doc_para_5_1"
      ]
    },
    {
      "id": "stk_older_disabled",
      "name": "Older and Disabled Passengers",
      "archetype_group": "consumer",
      "stance_prior": "supportive_with_conditions",
      "interests": [
        "policy_impact"
      ],
      "evidence_fact_ids": [
        "doc_para_3_1",
        "doc_para_3_2"
      ]
    },
    {
      "id": "stk_general_public",
      "name": "General Public / Passengers",
      "archetype_group": "consumer",
      "stance_prior": "neutral",
      "interests": [
        "policy_impact"
      ],
      "evidence_fact_ids": [
        "doc_para_4_4",
        "doc_para_4_5",
        "doc_para_7_1"
      ]
    }
  ],
  "assumptions": [
    {
      "id": "assump_1",
      "statement": "The APS permitting scheme will provide a clear legal route for deploying commercial passenger services with no human driver, giving operators certainty to enter the GB market.",
      "status": "stated",
      "evidence_fact_ids": [
        "doc_intro_2"
      ]
    },
    {
      "id": "assump_2",
      "statement": "Without the APS permitting scheme, automated passenger services 'may either be banned or entirely unregulated' (Law Commissions).",
      "status": "stated",
      "evidence_fact_ids": [
        "doc_intro_3"
      ]
    },
    {
      "id": "assump_3",
      "statement": "The APS permitting scheme will sit alongside existing taxi/PHV/PSV licensing routes, not replace them.",
      "status": "stated",
      "evidence_fact_ids": [
        "doc_intro_4"
      ]
    },
    {
      "id": "assump_4",
      "statement": "Consent from local licensing authorities or franchising bodies is critical for clarity and successful deployment.",
      "status": "stated",
      "evidence_fact_ids": [
        "doc_para_2_1"
      ]
    },
    {
      "id": "assump_5",
      "statement": "The Secretary of State must consider whether granting a permit is likely to improve understanding of how APS should be designed for older and disabled passengers.",
      "status": "stated",
      "evidence_fact_ids": [
        "doc_para_3_1"
      ]
    },
    {
      "id": "assump_6",
      "statement": "Permit holders must publish reports about their service, particularly steps taken to meet needs of older/disabled passengers and safeguard passengers generally.",
      "status": "stated",
      "evidence_fact_ids": [
        "doc_para_3_2"
      ]
    },
    {
      "id": "assump_7",
      "statement": "The application and renewal processes should be flexible rather than fixed by legislation, allowing revision over time.",
      "status": "stated",
      "evidence_fact_ids": [
        "doc_para_4_2"
      ]
    },
    {
      "id": "assump_8",
      "statement": "Civil sanctions will not be implemented for pilots; variation/suspension/withdrawal will be the enforcement means initially.",
      "status": "stated",
      "evidence_fact_ids": [
        "doc_para_1_6",
        "doc_para_5_1"
      ]
    },
    {
      "id": "assump_9",
      "statement": "A formal appeals system in court or tribunal is not proposed at this stage; internal DVSA review is provided instead.",
      "status": "stated",
      "evidence_fact_ids": [
        "doc_para_6_1"
      ]
    },
    {
      "id": "assump_10",
      "statement": "Fees will not be charged initially; the intention is to introduce fees for full cost recovery after full implementation of the AV Act.",
      "status": "stated",
      "evidence_fact_ids": [
        "doc_para_4_6"
      ]
    }
  ],
  "constraints": [
    {
      "id": "con_legal_1",
      "kind": "legal",
      "statement": "The APS permitting scheme is introduced through the Automated Vehicles (AV) Act 2024 and secondary legislation; the consultation does not seek views on the Act itself.",
      "evidence_fact_ids": [
        "doc_intro_2",
        "doc_para_1_1"
      ]
    },
    {
      "id": "con_legal_2",
      "kind": "legal",
      "statement": "Permits may only be issued with consent of the licensing authority for each place where a taxi/PHV-like service is provided, or franchising authority for bus-like services in franchising areas.",
      "evidence_fact_ids": [
        "doc_para_2_1"
      ]
    },
    {
      "id": "con_legal_3",
      "kind": "legal",